content,tag
Herr Hammarskjöld Hjalmar Vad hans excellens statsministern yttradensärskilt gentemot mig föranleder endast en helt kort replik,intro
Herr Ljunglund Herr talman Jag skall be att få svara med några ord pånhans excellens herr statsministerns replik,intro
Hans excellens herr ministern för utrikes ärendena Sandler Herr talmannStatsutskottet har nedlagt stort intresse på behandlingen av denna angelägenhetn Utskottet har därvid utformat en annan linje än den som är föreslagennfrån Kungl Majts sida Utskottets linje omfattas av ett överväldigande flertaln inom utskottet Jag anser mig ändock böra i korthet utveckla de synpunktern enligt vilka jag menar att Kungl Majts förslag har företräde,intro
Herr Domö erhöll nu ordet för kort genmäle och anförde Herr talman Förstnett svar på en direkt fråga från statsministern,intro
Herr Herou Herr talman Herr Andersson i Höör anförde en synpunktnsom jag icke vill låta stå oemotsagd en synpunkt som vi givetvis skulle varanmycket känsliga för därest hans uppgifter varit riktiga Han uppställer,intro
Herr ERIKSSON i Bäckmora (cp),intro
Anf 113 KURT HUGOSSON (s)nHerr talman Förra veckans finansdebatt visade hur isolerat moderatansamlingspartiet står med sina förslag på det ekonomiskpolitiska området,intro
Herr Flyg Herr talman Jag vill först fästa uppmärksamheten vid attndenna fråga kommer upp på riksdagens arbetsschema vid en så sen tidpunktnNog synes det mig böra ha varit möjligt för utrikesutskottet att på ett tidigaren skede ha givit riksdagen möjlighet att taga ståndpunkt till de SPÖrsmåln som vi nu i elfte timmen skola yttra oss om Ty det gäller dock ej ennfråga vilken som helst Det är en fråga som kan komma att spela en avgöranden roll för Sverige i en måhända nära liggande allvarlig morgondag Detnär en fråga som i det ögonblick då ett nytt världskrig bryter ut kan innebäran att Sverige trots alla sina bestämda deklarationer om vilja till neutralitetn och oberoende drages in i denna världsbrand enbart genom sitt medlemskapn i Nationernas förbund Jag har velat säga dessa ord beträffande utrikesutskottetsn arbetsmetoder även i medvetande om att det naturligtvis ingentingn gagnar att uttala en dylik protest,intro
Herr CASSEL (h) kort genmäle Herrntalman Herr Ohlin tog mig litet i upptuktelsen och jag är tacksam för att fånråd och anvisningar av en mera erfarenn kammarledamot om hur man skallnuppträda i det politiska livet,intro
Chefen för justitiedepartementet herrnstatsrådet ZETTERBERG Herr talmannHerr Ohlin sade att frågan huruvidanman skulle behålla fängelsestraffet ellerninte var av principiell betydelse ochnatt man därför skulle kunna ta uppnden till sakligt avgörande nu fastännlagen bara har varit i kraft så kort tidnJag skulle vilja säga att det nog är riktigtn att denna fråga om straffskalan harnallmänna och principiella aspekternmen jag skulle just därför vilja varnanför att man ändrar den ståndpunkt somnman i den delen efter mycket diskussionern och överväganden intog för ettnår sedan,intro
Herr Andersson i Tungelsta som anförde Herr talman Då man såvälnfrån motionärernas som utskottsmajoritetens sida syftat till att begränsa rättenn tillfri bärplockning har man framförallt motiverat detta med att dennanfråga nu skulle ha kommit i ett alldeles nytt läge Man har sagt att detnfinns så mycket människor ifrån städer och andra samhällen som resa ut ochnskövla bärmarkerna ute i bygderna Jag känner ganska väl till hur detnförhåller sig med denna sak i trakten kring Stockholm Jag vet mycket välnatt stockholmarna i stor utsträckning resa ut i bil och buss till skogarna ochnplocka bär men denna skövling av bärmarkerna från stadsinnebyggarnasnsida har icke i något fall som jag känner till varit av sådan beskaffenhetnatt jordbrukarna berövats möjligheten att skaffa sig sitt husbehov av lingonnDet har åtminstone icke varit fallet i de trakter där jag hör hemma Jagnvet ju att det någon gång förekommit att man vid dessa färder farit framnute i markerna på ett sätt som man måste reagera emot,intro
Herr TALMANNEN ytirade,intro
Herr SVENINGSSON (h),intro
Herr OSVALD (fp),intro
Herr GEZELIUS (h),intro
Herr LARSSON SIGFRID (bf),intro
Herr HECKSCHER (h),intro
Herr ÅKERSTRÖM (s)nHerr talman Jag yrkar bifall till utskottetsn hemställan,intro
Herr HANSSON i Skegrie (cp),intro
